{
	"formatVersion": 1,
	"gridWidth": 19,
	"gridHeight": 19,
	"palette": [
		{ "index": 0, "color": "#00000000", "reserved": true },
		{ "index": 1, "color": "#ffffffff", "reserved": false },
		{ "index": 2, "color": "#fcad4eff", "reserved": false },
		{ "index": 3, "color": "#fee2ceff", "reserved": false },
		{ "index": 4, "color": "#010000ff", "reserved": false }
	],
	"pixels": [
		1, 4, 4, 1, 1, 1, 1, 1, 1, 1, 1, 1, 4, 4, 1, 1, 1, 1, 1, 4, 2, 2, 4, 1, 1,
		1, 1, 1, 1, 1, 4, 2, 2, 4, 1, 1, 1, 1, 4, 3, 3, 2, 4, 1, 1, 1, 1, 4, 4, 2,
		3, 3, 4, 1, 1, 1, 1, 4, 3, 3, 3, 2, 4, 4, 4, 4, 2, 4, 3, 3, 3, 4, 1, 1, 1,
		1, 4, 3, 3, 2, 2, 2, 2, 2, 2, 2, 2, 2, 3, 3, 4, 1, 1, 1, 1, 4, 2, 2, 2, 2,
		2, 2, 2, 2, 2, 2, 2, 2, 2, 4, 1, 1, 1, 1, 1, 4, 2, 2, 2, 2, 2, 2, 2, 2, 2,
		2, 2, 4, 1, 1, 1, 1, 1, 4, 2, 2, 2, 2, 2, 2, 2, 2, 2, 2, 2, 2, 2, 4, 1, 1,
		1, 1, 4, 2, 2, 2, 2, 2, 2, 2, 2, 2, 2, 2, 2, 2, 4, 1, 1, 1, 1, 4, 2, 2, 2,
		4, 2, 2, 2, 2, 4, 2, 2, 2, 2, 4, 1, 1, 1, 1, 4, 1, 1, 1, 4, 1, 4, 1, 1, 4,
		1, 1, 1, 1, 4, 1, 1, 1, 1, 1, 4, 1, 1, 1, 1, 1, 1, 1, 1, 1, 1, 1, 4, 1, 1,
		1, 1, 1, 1, 1, 4, 1, 1, 1, 1, 1, 1, 1, 1, 1, 4, 1, 1, 1, 4, 4, 4, 1, 1, 1,
		4, 1, 1, 1, 1, 1, 2, 2, 2, 4, 1, 4, 4, 1, 1, 4, 1, 1, 4, 2, 2, 1, 1, 2, 2,
		2, 2, 2, 2, 4, 2, 1, 1, 1, 4, 1, 1, 4, 2, 2, 1, 1, 2, 2, 2, 2, 2, 2, 4, 2,
		2, 1, 1, 4, 1, 4, 2, 4, 2, 4, 1, 4, 2, 2, 2, 2, 2, 4, 2, 2, 2, 4, 1, 1, 4,
		2, 4, 2, 4, 4, 2, 4, 2, 2, 2, 4, 2, 2, 2, 4, 1, 1, 1, 1, 4, 4, 4, 4, 4, 4,
		4, 4, 4, 4, 1, 4, 4, 4, 1, 1, 1
	]
}
