{
	"formatVersion": 1,
	"gridWidth": 15,
	"gridHeight": 15,
	"palette": [
		{ "index": 0, "color": "#00000000", "reserved": true },
		{ "index": 1, "color": "#000000ff", "reserved": false },
		{ "index": 2, "color": "#49b0f3ff", "reserved": false },
		{ "index": 3, "color": "#a0ae59ff", "reserved": false },
		{ "index": 4, "color": "#3b8fd7ff", "reserved": false },
		{ "index": 5, "color": "#2763a1ff", "reserved": false },
		{ "index": 6, "color": "#becb54ff", "reserved": false }
	],
	"pixels": [
		0, 0, 0, 0, 0, 1, 1, 1, 1, 1, 0, 0, 0, 0, 0, 0, 0, 0, 1, 1, 2, 2, 2, 2, 6,
		1, 1, 0, 0, 0, 0, 0, 1, 4, 2, 2, 2, 2, 6, 6, 6, 6, 1, 0, 0, 0, 1, 4, 2, 2,
		2, 2, 6, 6, 6, 6, 6, 6, 1, 0, 0, 1, 4, 2, 2, 2, 2, 6, 6, 6, 6, 6, 6, 1, 0,
		1, 4, 2, 2, 2, 2, 6, 2, 2, 6, 6, 6, 6, 3, 1, 1, 4, 2, 2, 2, 6, 6, 6, 2, 4,
		4, 3, 3, 3, 1, 1, 4, 2, 2, 6, 6, 6, 6, 6, 6, 6, 5, 3, 3, 1, 1, 4, 4, 2, 6,
		6, 3, 6, 6, 6, 3, 3, 5, 3, 1, 1, 6, 4, 4, 3, 3, 3, 3, 6, 6, 3, 3, 5, 5, 1,
		0, 1, 6, 4, 4, 4, 4, 6, 6, 3, 3, 5, 5, 1, 0, 0, 1, 3, 6, 4, 4, 4, 3, 3, 3,
		5, 5, 5, 1, 0, 0, 0, 1, 3, 3, 4, 4, 3, 3, 5, 5, 5, 1, 0, 0, 0, 0, 0, 1, 1,
		5, 5, 5, 5, 5, 1, 1, 0, 0, 0, 0, 0, 0, 0, 0, 1, 1, 1, 1, 1, 0, 0, 0, 0, 0
	]
}
