{
	"formatVersion": 1,
	"gridWidth": 15,
	"gridHeight": 15,
	"palette": [
		{ "index": 0, "color": "#00000000", "reserved": true },
		{ "index": 1, "color": "#f78e4aff", "reserved": false },
		{ "index": 2, "color": "#f7b7edff", "reserved": false },
		{ "index": 3, "color": "#ffffffff", "reserved": false },
		{ "index": 4, "color": "#1a1c19ff", "reserved": false }
	],
	"pixels": [
		0, 0, 0, 0, 0, 0, 0, 0, 0, 0, 0, 0, 0, 0, 0, 0, 0, 0, 0, 4, 0, 0, 0, 0, 0,
		0, 0, 0, 0, 0, 0, 0, 0, 0, 0, 0, 0, 0, 0, 0, 0, 0, 0, 0, 0, 0, 0, 0, 0, 0,
		4, 4, 4, 4, 4, 0, 0, 0, 0, 0, 0, 0, 0, 0, 4, 4, 4, 4, 4, 4, 4, 0, 0, 0, 0,
		0, 0, 0, 4, 4, 3, 3, 3, 3, 3, 4, 4, 0, 0, 0, 0, 0, 0, 4, 3, 3, 3, 3, 3, 3,
		3, 4, 0, 0, 0, 0, 0, 0, 4, 3, 4, 3, 1, 3, 4, 3, 4, 0, 0, 0, 0, 0, 0, 4, 2,
		3, 1, 1, 1, 3, 2, 4, 0, 0, 0, 0, 0, 4, 4, 3, 3, 3, 3, 3, 3, 3, 4, 4, 0, 0,
		0, 4, 4, 4, 3, 3, 3, 3, 3, 3, 3, 4, 4, 4, 0, 0, 0, 0, 4, 3, 3, 3, 3, 3, 3,
		3, 4, 0, 0, 0, 0, 0, 0, 0, 4, 3, 3, 3, 3, 3, 4, 0, 0, 0, 0, 0, 0, 0, 1, 1,
		4, 4, 4, 4, 4, 1, 1, 0, 0, 0, 0, 0, 0, 0, 0, 0, 0, 0, 0, 0, 0, 0, 0, 0, 0
	]
}
