{
	"formatVersion": 1,
	"gridWidth": 27,
	"gridHeight": 29,
	"palette": [
		{ "index": 0, "color": "#00000000", "reserved": true },
		{ "index": 1, "color": "#000000ff", "reserved": false },
		{ "index": 2, "color": "#dd85aaff", "reserved": false },
		{ "index": 3, "color": "#9c96a0ff", "reserved": false },
		{ "index": 4, "color": "#6eaed1ff", "reserved": false },
		{ "index": 5, "color": "#635a59ff", "reserved": false },
		{ "index": 6, "color": "#ffffffff", "reserved": false }
	],
	"pixels": [
		6, 6, 6, 6, 6, 6, 6, 6, 5, 6, 6, 6, 6, 6, 6, 6, 6, 6, 6, 5, 6, 6, 6, 6, 6,
		6, 6, 6, 6, 6, 6, 6, 6, 6, 5, 6, 5, 6, 6, 6, 6, 6, 6, 6, 6, 5, 6, 5, 6, 6,
		6, 6, 6, 6, 6, 6, 6, 6, 6, 6, 5, 6, 3, 5, 6, 6, 6, 6, 6, 6, 6, 6, 5, 6, 3,
		5, 6, 6, 6, 6, 6, 6, 6, 6, 6, 6, 6, 5, 6, 3, 3, 5, 6, 6, 6, 6, 6, 6, 5, 6,
		3, 3, 5, 6, 6, 6, 6, 6, 6, 6, 6, 6, 6, 6, 5, 6, 3, 3, 5, 6, 6, 6, 6, 6, 6,
		5, 6, 3, 3, 5, 6, 6, 6, 6, 6, 6, 6, 6, 6, 6, 6, 5, 6, 3, 3, 3, 5, 6, 6, 6,
		6, 5, 6, 3, 3, 3, 5, 6, 6, 6, 6, 6, 6, 6, 6, 6, 6, 6, 5, 6, 3, 3, 3, 5, 6,
		6, 6, 6, 5, 6, 3, 3, 3, 5, 6, 6, 6, 6, 6, 6, 6, 6, 6, 6, 6, 6, 5, 6, 3, 3,
		5, 6, 6, 6, 6, 5, 6, 3, 3, 3, 5, 6, 6, 6, 6, 6, 6, 6, 6, 6, 6, 6, 5, 6, 3,
		3, 3, 3, 5, 5, 5, 5, 6, 3, 3, 3, 5, 6, 6, 6, 6, 6, 6, 6, 6, 6, 6, 6, 5, 6,
		3, 3, 3, 3, 3, 3, 3, 3, 3, 3, 3, 3, 3, 3, 5, 6, 6, 6, 6, 6, 6, 6, 6, 6, 5,
		3, 3, 3, 3, 3, 3, 3, 3, 3, 3, 3, 3, 3, 3, 3, 3, 3, 5, 6, 6, 6, 6, 5, 5, 6,
		6, 5, 3, 6, 6, 6, 3, 3, 3, 3, 3, 3, 3, 3, 3, 6, 6, 6, 3, 5, 6, 6, 5, 5, 6,
		6, 5, 5, 3, 6, 1, 1, 6, 6, 3, 3, 3, 3, 3, 3, 3, 6, 1, 1, 6, 6, 3, 5, 5, 6,
		6, 5, 5, 6, 5, 3, 6, 1, 1, 1, 6, 3, 3, 1, 1, 1, 3, 3, 6, 1, 1, 1, 6, 3, 5,
		6, 5, 5, 6, 6, 5, 5, 3, 6, 4, 1, 1, 6, 3, 3, 3, 1, 3, 3, 3, 6, 4, 1, 1, 6,
		3, 5, 5, 6, 6, 5, 5, 5, 3, 3, 3, 6, 6, 6, 3, 3, 3, 3, 3, 3, 3, 3, 3, 6, 6,
		6, 3, 3, 3, 5, 5, 5, 6, 6, 5, 3, 3, 2, 2, 3, 3, 3, 3, 3, 3, 3, 3, 3, 3, 3,
		3, 3, 2, 2, 3, 3, 5, 6, 6, 6, 5, 3, 3, 3, 3, 3, 3, 3, 3, 4, 4, 4, 4, 4, 4,
		4, 3, 3, 3, 3, 3, 3, 3, 3, 5, 6, 6, 5, 3, 3, 3, 3, 3, 3, 3, 4, 6, 6, 6, 6,
		6, 6, 6, 4, 3, 3, 3, 3, 3, 3, 3, 5, 6, 5, 3, 3, 3, 3, 3, 3, 3, 4, 6, 6, 6,
		6, 3, 6, 6, 6, 6, 4, 3, 3, 3, 6, 3, 3, 3, 5, 5, 3, 3, 6, 5, 3, 3, 4, 6, 3,
		6, 6, 3, 6, 3, 6, 6, 3, 6, 4, 3, 3, 5, 6, 3, 3, 5, 5, 6, 3, 6, 5, 3, 3, 4,
		3, 6, 3, 6, 6, 6, 6, 6, 3, 6, 3, 4, 3, 3, 5, 6, 3, 6, 5, 6, 5, 6, 5, 3, 3,
		4, 6, 6, 6, 6, 6, 6, 6, 6, 6, 6, 6, 6, 6, 4, 3, 3, 5, 6, 5, 6, 6, 6, 5, 5,
		3, 3, 4, 6, 6, 6, 6, 6, 6, 6, 6, 6, 6, 6, 6, 6, 4, 3, 3, 5, 5, 6, 6, 6, 6,
		6, 5, 3, 3, 4, 6, 6, 6, 6, 6, 6, 6, 6, 6, 6, 6, 6, 6, 4, 3, 3, 5, 6, 6, 6,
		6, 6, 6, 5, 3, 3, 4, 6, 6, 6, 6, 6, 6, 6, 6, 6, 6, 6, 6, 6, 4, 3, 3, 5, 6,
		6, 6, 6, 6, 6, 6, 5, 3, 4, 6, 6, 6, 6, 6, 6, 6, 6, 6, 6, 6, 6, 6, 4, 3, 5,
		6, 6, 6, 6, 6, 6, 6, 6, 6, 5, 3, 4, 4, 4, 4, 4, 4, 4, 4, 4, 4, 4, 4, 4, 3,
		5, 6, 6, 6, 6, 6, 6, 6, 6, 6, 6, 6, 5, 5, 5, 5, 5, 5, 5, 5, 5, 5, 5, 5, 5,
		5, 5, 6, 6, 6, 6, 6, 6
	]
}
