{
	"formatVersion": 1,
	"gridWidth": 15,
	"gridHeight": 14,
	"palette": [
		{ "index": 0, "color": "#00000000", "reserved": true },
		{ "index": 1, "color": "#000000ff", "reserved": false },
		{ "index": 2, "color": "#efcdb2ff", "reserved": false },
		{ "index": 3, "color": "#616161ff", "reserved": false },
		{ "index": 4, "color": "#b58530ff", "reserved": false },
		{ "index": 5, "color": "#30270aff", "reserved": false },
		{ "index": 6, "color": "#f69988ff", "reserved": false },
		{ "index": 7, "color": "#ffffffff", "reserved": false }
	],
	"pixels": [
		1, 1, 7, 7, 7, 7, 1, 1, 1, 7, 7, 7, 7, 7, 7, 1, 2, 1, 7, 7, 1, 2, 2, 1, 7,
		7, 7, 7, 7, 7, 1, 2, 3, 1, 1, 3, 2, 2, 1, 7, 7, 7, 7, 7, 7, 1, 4, 3, 7, 3,
		4, 4, 4, 1, 7, 7, 7, 7, 7, 7, 1, 4, 7, 7, 4, 4, 4, 4, 1, 7, 7, 7, 7, 7, 7,
		1, 7, 5, 7, 4, 5, 4, 4, 1, 7, 7, 7, 1, 1, 7, 1, 7, 5, 7, 7, 5, 4, 4, 1, 7,
		7, 1, 4, 4, 1, 1, 7, 7, 6, 7, 7, 7, 7, 1, 1, 7, 1, 4, 1, 1, 7, 1, 7, 7, 7,
		7, 7, 1, 4, 4, 1, 4, 4, 1, 7, 7, 7, 1, 7, 7, 7, 7, 7, 7, 7, 4, 1, 1, 7, 7,
		7, 7, 1, 7, 7, 7, 7, 7, 7, 7, 7, 1, 7, 7, 7, 7, 7, 1, 7, 1, 7, 1, 7, 7, 1,
		7, 1, 7, 7, 7, 7, 7, 1, 7, 1, 7, 1, 1, 1, 1, 7, 1, 7, 7, 7, 7, 7, 1, 1, 1,
		1, 1, 7, 1, 1, 1, 1, 7, 7, 7
	]
}
