{
	"formatVersion": 1,
	"gridWidth": 16,
	"gridHeight": 16,
	"palette": [
		{ "index": 0, "color": "#00000000", "reserved": true },
		{ "index": 1, "color": "#f1b03fff", "reserved": false },
		{ "index": 2, "color": "#ad6130ff", "reserved": false },
		{ "index": 3, "color": "#61371eff", "reserved": false },
		{ "index": 4, "color": "#101112ff", "reserved": false }
	],
	"pixels": [
		0, 0, 0, 0, 0, 0, 0, 0, 0, 0, 0, 0, 0, 0, 0, 0, 0, 0, 0, 3, 3, 3, 3, 3, 3,
		3, 3, 3, 0, 0, 0, 0, 0, 0, 3, 1, 1, 2, 2, 2, 2, 2, 1, 1, 3, 0, 0, 0, 0, 3,
		3, 1, 2, 1, 2, 2, 2, 1, 2, 1, 3, 0, 0, 0, 0, 3, 2, 2, 1, 1, 1, 1, 1, 1, 1,
		2, 3, 3, 0, 0, 0, 3, 2, 2, 1, 1, 1, 1, 1, 1, 1, 2, 2, 3, 0, 0, 0, 3, 2, 2,
		1, 4, 1, 1, 1, 4, 1, 2, 2, 3, 0, 0, 0, 3, 2, 2, 1, 1, 1, 4, 1, 1, 1, 2, 3,
		3, 0, 0, 0, 3, 3, 2, 2, 1, 1, 1, 1, 1, 2, 2, 3, 0, 0, 0, 0, 0, 3, 3, 2, 2,
		2, 2, 2, 2, 2, 3, 0, 0, 0, 0, 0, 0, 0, 3, 3, 3, 3, 3, 3, 3, 3, 3, 0, 3, 3,
		0, 0, 0, 0, 3, 1, 1, 1, 1, 1, 1, 3, 0, 0, 3, 3, 0, 0, 0, 0, 3, 1, 3, 1, 2,
		1, 1, 3, 3, 1, 2, 0, 0, 0, 0, 0, 3, 1, 3, 1, 2, 1, 1, 1, 3, 2, 0, 0, 0, 0,
		0, 0, 3, 3, 3, 3, 3, 3, 3, 3, 3, 0, 0, 0, 0, 0, 0, 0, 0, 0, 0, 0, 0, 0, 0,
		0, 0, 0, 0, 0, 0
	]
}
